{
 "format": "tdd-kg/v1",
 "ontologyVersion": "tdd-core-1+ext-1",
 "feature": "SCHEDULED-TRANSFER",
 "package": {
  "kind": "slice",
  "cr": "CR-001",
  "generatedAt": "2026-10-12T08:11:19Z",
  "sourceHash": "sha256:b4f026cb526f42c347678025d68be352473e5bafb212bf5e82f006c40ef2cfd5"
 },
 "ontology": {
  "classes": [
   {
    "name": "Alternative",
    "parent": "Entity",
    "required": [
     "code",
     "reasonRejected"
    ],
    "attrs": [
     "reasonRejected"
    ],
    "doc": "Phương án đã loại"
   },
   {
    "name": "Assumption",
    "parent": "Entity",
    "required": [
     "code",
     "statement"
    ],
    "attrs": [
     "statement",
     "dueDate",
     "confirmStatus"
    ],
    "doc": "Giả định"
   },
   {
    "name": "Channel",
    "parent": "Entity",
    "required": [
     "code",
     "partitionKey",
     "deliverySemantics"
    ],
    "attrs": [
     "partitionKey",
     "partitionCount",
     "deliverySemantics",
     "retentionDays",
     "maxMessageKB",
     "dlqName",
     "consumerIdempotent"
    ],
    "doc": "Topic/queue"
   },
   {
    "name": "CircuitBreaker",
    "parent": "Entity",
    "required": [
     "code",
     "failureRatePercent",
     "minimumCalls",
     "openDurationSec"
    ],
    "attrs": [
     "failureRatePercent",
     "minimumCalls",
     "openDurationSec"
    ],
    "doc": "Circuit breaker"
   },
   {
    "name": "ConnectionPool",
    "parent": "Entity",
    "required": [
     "code",
     "maxTotal"
    ],
    "attrs": [
     "maxTotal",
     "maxPerRoute",
     "minIdle",
     "maxLifetimeSec",
     "idleTimeoutSec",
     "validationEnabled",
     "bulkheadGroup"
    ],
    "doc": "Connection pool"
   },
   {
    "name": "Constraint",
    "parent": "Entity",
    "required": [
     "code",
     "constraintType"
    ],
    "attrs": [
     "constraintType"
    ],
    "doc": "Ràng buộc"
   },
   {
    "name": "DataEntity",
    "parent": "Entity",
    "required": [
     "code"
    ],
    "attrs": [
     "retentionRule",
     "volumeEstimate"
    ],
    "doc": "Thực thể dữ liệu logic"
   },
   {
    "name": "Decision",
    "parent": "Entity",
    "required": [
     "code",
     "statement"
    ],
    "attrs": [
     "statement",
     "rationale",
     "noAlternativeNote"
    ],
    "doc": "Quyết định kỹ thuật (ADR)"
   },
   {
    "name": "DesignItem",
    "parent": "Entity",
    "required": [
     "code",
     "kind",
     "location"
    ],
    "attrs": [
     "kind",
     "location",
     "demoImplementation"
    ],
    "doc": "Mục LLD / vị trí code"
   },
   {
    "name": "Document",
    "parent": "Entity",
    "required": [
     "code",
     "docType"
    ],
    "attrs": [
     "docType",
     "baselineDate"
    ],
    "doc": "Tài liệu nguồn/đích"
   },
   {
    "name": "Endpoint",
    "parent": "Entity",
    "required": [
     "code",
     "method",
     "path"
    ],
    "attrs": [
     "method",
     "path",
     "apiVersion",
     "mediaType"
    ],
    "doc": "Endpoint REST"
   },
   {
    "name": "Entity",
    "parent": "Entity",
    "required": [
     "code"
    ],
    "attrs": [],
    "doc": "Lớp gốc: thuộc tính chung cho mọi nút"
   },
   {
    "name": "Environment",
    "parent": "Entity",
    "required": [
     "code"
    ],
    "attrs": [
     "hostingType"
    ],
    "doc": "Môi trường"
   },
   {
    "name": "ErrorMapping",
    "parent": "Entity",
    "required": [
     "code",
     "trigger",
     "errorCategory",
     "retryable",
     "action"
    ],
    "attrs": [
     "trigger",
     "errorCategory",
     "retryable",
     "action"
    ],
    "doc": "Xử lý một kết quả lỗi"
   },
   {
    "name": "Evidence",
    "parent": "Entity",
    "required": [
     "code",
     "summary"
    ],
    "attrs": [
     "summary",
     "measuredAt",
     "location",
     "metrics"
    ],
    "doc": "PoC/benchmark/đo đạc"
   },
   {
    "name": "ExternalParty",
    "parent": "Entity",
    "required": [
     "code",
     "partyType"
    ],
    "attrs": [
     "partyType",
     "ownerContact",
     "sandboxAvailable",
     "maintenanceWindow",
     "contractConfirmed"
    ],
    "doc": "Đối tác/hệ thống ngoài"
   },
   {
    "name": "FallbackStrategy",
    "parent": "Entity",
    "required": [
     "code",
     "mode"
    ],
    "attrs": [
     "mode"
    ],
    "doc": "Dự phòng khi đối tác lỗi"
   },
   {
    "name": "FunctionalRequirement",
    "parent": "Requirement",
    "required": [
     "code",
     "text"
    ],
    "attrs": [],
    "doc": "Yêu cầu chức năng"
   },
   {
    "name": "Header",
    "parent": "Entity",
    "required": [
     "code",
     "name",
     "required"
    ],
    "attrs": [
     "name",
     "required",
     "example"
    ],
    "doc": "Header/metadata"
   },
   {
    "name": "Integration",
    "parent": "Entity",
    "required": [
     "code",
     "integrationType",
     "direction",
     "interactionStyle",
     "idempotent"
    ],
    "attrs": [
     "integrationType",
     "direction",
     "interactionStyle",
     "protocol",
     "idempotent",
     "expectedRps",
     "demoImplementation"
    ],
    "doc": "Điểm tích hợp - gốc của contract"
   },
   {
    "name": "Mechanism",
    "parent": "Entity",
    "required": [
     "code",
     "mechanismKind"
    ],
    "attrs": [
     "mechanismKind"
    ],
    "doc": "Cơ chế đáp ứng NFR / dùng chung"
   },
   {
    "name": "Message",
    "parent": "Entity",
    "required": [
     "code",
     "messageType"
    ],
    "attrs": [
     "messageType",
     "direction",
     "example",
     "sensitiveFields"
    ],
    "doc": "Payload/sự kiện"
   },
   {
    "name": "Module",
    "parent": "Entity",
    "required": [
     "code",
     "responsibility"
    ],
    "attrs": [
     "responsibility",
     "layer"
    ],
    "doc": "Module/thành phần"
   },
   {
    "name": "MonitoringSpec",
    "parent": "Entity",
    "required": [
     "code"
    ],
    "attrs": [
     "metrics",
     "alertThreshold"
    ],
    "doc": "Giám sát"
   },
   {
    "name": "NonFunctionalRequirement",
    "parent": "Requirement",
    "required": [
     "code",
     "text"
    ],
    "attrs": [],
    "doc": "Yêu cầu phi chức năng"
   },
   {
    "name": "OpenQuestion",
    "parent": "Entity",
    "required": [
     "code",
     "statement"
    ],
    "attrs": [
     "statement",
     "dueDate",
     "confirmStatus"
    ],
    "doc": "Câu hỏi mở"
   },
   {
    "name": "PartnerLimit",
    "parent": "Entity",
    "required": [
     "code",
     "maxConcurrentConnections"
    ],
    "attrs": [
     "requestsPerSecond",
     "maxPayloadKB",
     "maxConcurrentConnections",
     "slaAvailabilityPercent",
     "p99LatencyMs"
    ],
    "doc": "Giới hạn phía đối tác"
   },
   {
    "name": "ReconciliationJob",
    "parent": "Entity",
    "required": [
     "code"
    ],
    "attrs": [
     "schedule",
     "scope"
    ],
    "doc": "Đối soát định kỳ"
   },
   {
    "name": "Requirement",
    "parent": "Entity",
    "required": [
     "code",
     "text"
    ],
    "attrs": [
     "text",
     "priority",
     "targetValue",
     "targetUnit"
    ],
    "doc": "Yêu cầu"
   },
   {
    "name": "RetryPolicy",
    "parent": "Entity",
    "required": [
     "code",
     "maxAttempts",
     "idempotentOnly"
    ],
    "attrs": [
     "maxAttempts",
     "backoffType",
     "jitter",
     "idempotentOnly"
    ],
    "doc": "Chính sách retry"
   },
   {
    "name": "Risk",
    "parent": "Entity",
    "required": [
     "code",
     "likelihood",
     "impact"
    ],
    "attrs": [
     "likelihood",
     "impact",
     "mitigation"
    ],
    "doc": "Rủi ro kỹ thuật"
   },
   {
    "name": "Scenario",
    "parent": "Entity",
    "required": [
     "code",
     "responseBudgetMs"
    ],
    "attrs": [
     "steps",
     "responseBudgetMs"
    ],
    "doc": "Luồng xử lý chính"
   },
   {
    "name": "Schema",
    "parent": "Entity",
    "required": [
     "code",
     "format",
     "location"
    ],
    "attrs": [
     "format",
     "schemaVersion",
     "location",
     "compatibilityRule"
    ],
    "doc": "Schema payload"
   },
   {
    "name": "SecurityScheme",
    "parent": "Entity",
    "required": [
     "code",
     "schemeType"
    ],
    "attrs": [
     "schemeType",
     "secretStore",
     "rotationDays",
     "signatureCheck"
    ],
    "doc": "Cơ chế bảo mật"
   },
   {
    "name": "Technology",
    "parent": "Entity",
    "required": [
     "code",
     "category"
    ],
    "attrs": [
     "category",
     "techVersion"
    ],
    "doc": "Công nghệ"
   },
   {
    "name": "TestCase",
    "parent": "Entity",
    "required": [
     "code",
     "level"
    ],
    "attrs": [
     "level",
     "testStatus",
     "location"
    ],
    "doc": "Test case"
   },
   {
    "name": "TimeoutPolicy",
    "parent": "Entity",
    "required": [
     "code",
     "connectMs",
     "readMs",
     "totalMs"
    ],
    "attrs": [
     "connectMs",
     "readMs",
     "totalMs",
     "poolAcquireMs",
     "idleMs"
    ],
    "doc": "Timeout phía client"
   },
   {
    "name": "DesignObligation",
    "parent": "Entity",
    "required": [
     "code"
    ],
    "attrs": [
     "question",
     "subjectScope",
     "applicability",
     "requiredChecks"
    ],
    "doc": "module 04: DesignObligation"
   },
   {
    "name": "ObligationResolution",
    "parent": "Entity",
    "required": [
     "code"
    ],
    "attrs": [
     "status",
     "explanation"
    ],
    "doc": "module 04: ObligationResolution"
   },
   {
    "name": "DesignGap",
    "parent": "Entity",
    "required": [
     "code"
    ],
    "attrs": [
     "missingKnowledge",
     "owner",
     "blockingGates"
    ],
    "doc": "module 04: DesignGap"
   },
   {
    "name": "Operation",
    "parent": "Entity",
    "required": [
     "code"
    ],
    "attrs": [
     "inputs",
     "outputs",
     "preconditions",
     "postconditions",
     "errorOutcomes",
     "sideEffects",
     "authContext"
    ],
    "doc": "module 04: Operation"
   },
   {
    "name": "Invariant",